{
  "schemaVersion": 2,
  "kind": "REFERENCE_CATALOG",
  "commandSurfaceSource": "assets/development/capability-pack-contract.json#/commandSurface",
  "categories": {
    "core": [
      "auto-mode-core.md",
      "completion-gate-core.md",
      "enum.md",
      "execution-core.md",
      "lifecycle-core.md",
      "maintenance-entrypoints.md",
      "request-intake.md",
      "runtime-contract.md",
      "scope-core.md",
      "scope.md",
      "semantic-core.md",
      "work-mode-core.md",
      "compatibility-boundary.md"
    ],
    "requirement-design": [
      "business-flow.md",
      "business-model.md",
      "cross-module-impact.md",
      "design-core.md",
      "implementation-contract.md",
      "implementation-plan.md",
      "implementation-strategy-example.md",
      "implementation-strategy.md",
      "relationship-impact.md",
      "requirement-acceptance.md",
      "requirement-analysis-core.md",
      "requirement-confirmation-core.md",
      "requirement-traceability.md"
    ],
    "implementation": [
      "backend-code-reference.md",
      "code-comments.md",
      "debugging-core.md",
      "debugging.md",
      "develop.md",
      "model-code-core.md",
      "platform-core.md",
      "web-code-reference.md"
    ],
    "testing": [
      "integration-testing.md",
      "red-green-refactor.md",
      "tdd-core.md",
      "tdd-evidence.md",
      "tdd-role-boundary.md",
      "test-completion.md",
      "test-coverage-complexity.md",
      "test-data-isolation.md",
      "test-environment.md",
      "test-evidence.md",
      "test-matrix-design.md",
      "test-persistence.md",
      "test-seam.md",
      "testing-core.md",
      "verification-integration.md",
      "workflow-verification.md"
    ],
    "review-agents": [
      "architecture-review-development.md",
      "collaboration-review.md",
      "manual-review-guide.md",
      "orchestration-core.md",
      "review-core.md",
      "review-evidence.md",
      "review-knowledge.md",
      "review-result-contract.md",
      "risk-verification.md",
      "roles.md"
    ],
    "git-delivery": [
      "acceptance-core.md",
      "delivery-readiness.md",
      "git-checkpoint-core.md",
      "git-checkpoint.md"
    ],
    "recovery-archive": [
      "archive-core.md",
      "archive-documentation.md",
      "baseline-integrity.md",
      "long-task-core.md",
      "project-adoption.md",
      "task-context-optimization.md",
      "task-verification-core.md",
      "wk-ar-state-core.md",
      "wk-cli.md"
    ],
    "specialist": [
      "documentation-core.md",
      "domain-governance.md",
      "engineering-knowledge-graph.md",
      "evidence-core.md",
      "html-core.md",
      "onepage-html.md",
      "page-design-example.md",
      "page-design.md",
      "union-language.md",
      "document-style.md"
    ]
  },
  "entries": [
    {
      "source": "references/auto-mode-core.md",
      "target": "references/core/auto-mode-core.md",
      "category": "core",
      "status": "FORMAL_ATOMIC",
      "role": "core",
      "requires": [],
      "nextOn": [],
      "maxReadBytes": 24576,
      "machineAuthority": [
        "assets/runtime/runtime-contract.json"
      ],
      "deprecatedBy": null
    },
    {
      "source": "references/completion-gate-core.md",
      "target": "references/core/completion-gate-core.md",
      "category": "core",
      "status": "FORMAL_ATOMIC",
      "role": "core",
      "requires": [],
      "nextOn": [],
      "maxReadBytes": 24576,
      "machineAuthority": [
        "assets/runtime/runtime-contract.json"
      ],
      "deprecatedBy": null
    },
    {
      "source": "references/enum.md",
      "target": "references/core/enum.md",
      "category": "core",
      "status": "FORMAL_ATOMIC",
      "role": "core",
      "requires": [],
      "nextOn": [],
      "maxReadBytes": 24576,
      "machineAuthority": [
        "assets/runtime/runtime-contract.json"
      ],
      "deprecatedBy": null
    },
    {
      "source": "references/execution-core.md",
      "target": "references/core/execution-core.md",
      "category": "core",
      "status": "FORMAL_ATOMIC",
      "role": "core",
      "requires": [],
      "nextOn": [],
      "maxReadBytes": 24576,
      "machineAuthority": [
        "assets/runtime/runtime-contract.json"
      ],
      "deprecatedBy": null
    },
    {
      "source": "references/lifecycle-core.md",
      "target": "references/core/lifecycle-core.md",
      "category": "core",
      "status": "FORMAL_ATOMIC",
      "role": "quick",
      "requires": [],
      "nextOn": [
        {
          "when": "DETAIL_REQUIRED",
          "target": "references/core/lifecycle-core.detail.md"
        }
      ],
      "maxReadBytes": 4096,
      "machineAuthority": [
        "assets/runtime/runtime-contract.json"
      ],
      "deprecatedBy": null
    },
    {
      "source": "references/maintenance-entrypoints.md",
      "target": "references/core/maintenance-entrypoints.md",
      "category": "core",
      "status": "FORMAL_ATOMIC",
      "role": "core",
      "requires": [],
      "nextOn": [],
      "maxReadBytes": 24576,
      "machineAuthority": [
        "assets/runtime/runtime-contract.json"
      ],
      "deprecatedBy": null
    },
    {
      "source": "references/request-intake.md",
      "target": "references/core/request-intake.md",
      "category": "core",
      "status": "FORMAL_ATOMIC",
      "role": "core",
      "requires": [],
      "nextOn": [],
      "maxReadBytes": 24576,
      "machineAuthority": [
        "assets/runtime/runtime-contract.json"
      ],
      "deprecatedBy": null
    },
    {
      "source": "references/runtime-contract.md",
      "target": "references/core/runtime-contract.md",
      "category": "core",
      "status": "FORMAL_ATOMIC",
      "role": "core",
      "requires": [],
      "nextOn": [],
      "maxReadBytes": 24576,
      "machineAuthority": [
        "assets/runtime/runtime-contract.json"
      ],
      "deprecatedBy": null
    },
    {
      "source": "references/scope-core.md",
      "target": "references/core/scope-core.md",
      "category": "core",
      "status": "FORMAL_ATOMIC",
      "role": "core",
      "requires": [],
      "nextOn": [],
      "maxReadBytes": 24576,
      "machineAuthority": [
        "assets/runtime/runtime-contract.json"
      ],
      "deprecatedBy": null
    },
    {
      "source": "references/scope.md",
      "target": "references/core/scope.md",
      "category": "core",
      "status": "FORMAL_ATOMIC",
      "role": "core",
      "requires": [],
      "nextOn": [],
      "maxReadBytes": 24576,
      "machineAuthority": [
        "assets/runtime/runtime-contract.json"
      ],
      "deprecatedBy": null
    },
    {
      "source": "references/semantic-core.md",
      "target": "references/core/semantic-core.md",
      "category": "core",
      "status": "FORMAL_ATOMIC",
      "role": "core",
      "requires": [],
      "nextOn": [],
      "maxReadBytes": 24576,
      "machineAuthority": [
        "assets/runtime/runtime-contract.json"
      ],
      "deprecatedBy": null
    },
    {
      "source": "references/work-mode-core.md",
      "target": "references/core/work-mode-core.md",
      "category": "core",
      "status": "FORMAL_ATOMIC",
      "role": "core",
      "requires": [],
      "nextOn": [],
      "maxReadBytes": 24576,
      "machineAuthority": [
        "assets/runtime/runtime-contract.json"
      ],
      "deprecatedBy": null
    },
    {
      "source": "references/business-flow.md",
      "target": "references/requirement-design/business-flow.md",
      "category": "requirement-design",
      "status": "FORMAL_ATOMIC",
      "role": "quick",
      "requires": [],
      "nextOn": [
        {
          "when": "DETAIL_REQUIRED",
          "target": "references/requirement-design/business-flow.detail.md"
        }
      ],
      "maxReadBytes": 4096,
      "machineAuthority": [
        "assets/documents/structured-docs/business-flow.schema.json"
      ],
      "deprecatedBy": null
    },
    {
      "source": "references/business-model.md",
      "target": "references/requirement-design/business-model.md",
      "category": "requirement-design",
      "status": "FORMAL_ATOMIC",
      "role": "quick",
      "requires": [],
      "nextOn": [
        {
          "when": "DETAIL_REQUIRED",
          "target": "references/requirement-design/business-model.detail.md"
        },
        {
          "when": "REVIEW_OR_VALIDATION_REQUIRED",
          "target": "references/requirement-design/business-model.detail.part-2.md"
        }
      ],
      "maxReadBytes": 4096,
      "machineAuthority": [
        "assets/documents/structured-docs/business-model.schema.json"
      ],
      "deprecatedBy": null
    },
    {
      "source": "references/cross-module-impact.md",
      "target": "references/requirement-design/cross-module-impact.md",
      "category": "requirement-design",
      "status": "FORMAL_ATOMIC",
      "role": "core",
      "requires": [],
      "nextOn": [],
      "maxReadBytes": 24576,
      "machineAuthority": [
        "assets/runtime/runtime-contract.json"
      ],
      "deprecatedBy": null
    },
    {
      "source": "references/design-core.md",
      "target": "references/requirement-design/design-core.md",
      "category": "requirement-design",
      "status": "FORMAL_ATOMIC",
      "role": "core",
      "requires": [],
      "nextOn": [],
      "maxReadBytes": 24576,
      "machineAuthority": [
        "scripts/design_doc.py"
      ],
      "deprecatedBy": null
    },
    {
      "source": "references/implementation-contract.md",
      "target": "references/requirement-design/implementation-contract.md",
      "category": "requirement-design",
      "status": "FORMAL_ATOMIC",
      "role": "quick",
      "requires": [],
      "nextOn": [
        {
          "when": "DETAIL_REQUIRED",
          "target": "references/requirement-design/implementation-contract.detail.md"